{
  "schema_version": "0.1.0",
  "artifact_type": "foundational_study_closeout",
  "record_id": "LCMRP-FCLOSEREC-9902-SYNTHETIC-DRY-RUN-FORMAL",
  "record_version": 1,
  "immutable_record_notice": "Once published, this closeout is immutable. Corrections or retractions require a new record version linked to the superseded raw-byte digest.",
  "amendment": {
    "kind": "INITIAL",
    "supersedes_record_version": null,
    "supersedes_artifact_digest": null,
    "rationale": null,
    "changed_fields": []
  },
  "record_status": "PUBLISHED",
  "closeout_id": "LCMRP-FCLOSE-9902-SYNTHETIC-DRY-RUN-FORMAL",
  "research_layer": "LAYER_1_FOUNDATIONAL_RESEARCH",
  "study_reference": {
    "study_id": "LCMRP-FSTUDY-9902-SYNTHETIC-DRY-RUN-FORMAL",
    "study_record_id": "LCMRP-FSTUDYREC-9902-SYNTHETIC-DRY-RUN-FORMAL",
    "study_record_version": 1,
    "manifest_artifact": {
      "artifact_id": "ARTIFACT-9902-SYNTHETIC-DRY-RUN-STUDY-MANIFEST",
      "artifact_version": 1,
      "schema_id": "urn:lcmrp:schema:foundational-study-manifest:0.1.0",
      "locator": "examples/m1-dry-runs/formal-analysis/records/foundational/studies/LCMRP-FSTUDYREC-9902-SYNTHETIC-DRY-RUN-FORMAL-v1.json",
      "digest": {
        "algorithm": "SHA-256",
        "status": "VERIFIED",
        "value": "55dd5ce20c55ce788cdb2f178296b976025bec563f658245eaa5deb1f89c1f41",
        "scope": "RAW_FILE_BYTES"
      },
      "media_type": "application/json"
    }
  },
  "completion_scope": "EXACT_STUDY_RECORD_VERSION",
  "completeness_assertion": "EXACTLY_ONE_PUBLISHED_FINDING_PER_PLANNED_ANALYSIS",
  "analysis_dispositions": [
    {
      "analysis_id": "ANALYSIS-9902-SATISFIABILITY",
      "analysis_mode": "CONFIRMATORY",
      "finding_id": "LCMRP-FIND-9902-SYNTHETIC-DRY-RUN-SAT",
      "finding_record_id": "LCMRP-FINDREC-9902-SYNTHETIC-DRY-RUN-SAT",
      "finding_record_version": 1,
      "terminal_disposition": "COMPLETED",
      "finding_artifact": {
        "artifact_id": "ARTIFACT-9902-SYNTHETIC-DRY-RUN-SAT-FINDING",
        "artifact_version": 1,
        "schema_id": "urn:lcmrp:schema:research-finding-record:0.1.0",
        "locator": "examples/m1-dry-runs/formal-analysis/records/foundational/findings/LCMRP-FINDREC-9902-SYNTHETIC-DRY-RUN-SAT-v1.json",
        "digest": {
          "algorithm": "SHA-256",
          "status": "VERIFIED",
          "value": "3634684df3d3d2b81423a624cc900eab72222bc65e162f552603cfe2c85beeae",
          "scope": "RAW_FILE_BYTES"
        },
        "media_type": "application/json"
      }
    },
    {
      "analysis_id": "ANALYSIS-9902-ENTAILMENT-COUNTERMODEL",
      "analysis_mode": "CONFIRMATORY",
      "finding_id": "LCMRP-FIND-9902-SYNTHETIC-DRY-RUN-COUNTERMODEL",
      "finding_record_id": "LCMRP-FINDREC-9902-SYNTHETIC-DRY-RUN-COUNTERMODEL",
      "finding_record_version": 1,
      "terminal_disposition": "COMPLETED",
      "finding_artifact": {
        "artifact_id": "ARTIFACT-9902-SYNTHETIC-DRY-RUN-COUNTERMODEL-FINDING",
        "artifact_version": 1,
        "schema_id": "urn:lcmrp:schema:research-finding-record:0.1.0",
        "locator": "examples/m1-dry-runs/formal-analysis/records/foundational/findings/LCMRP-FINDREC-9902-SYNTHETIC-DRY-RUN-COUNTERMODEL-v1.json",
        "digest": {
          "algorithm": "SHA-256",
          "status": "VERIFIED",
          "value": "4a34f3c26d6a885e6d76f25624d76fb999432c11ea5484d98e69ae545815fb66",
          "scope": "RAW_FILE_BYTES"
        },
        "media_type": "application/json"
      }
    }
  ],
  "closeout_report_artifact": {
    "artifact_id": "ARTIFACT-9902-SYNTHETIC-DRY-RUN-CLOSEOUT-REPORT",
    "artifact_version": 1,
    "schema_id": "urn:lcmrp:synthetic-dry-run:foundational-study-closeout-report:0.1.0",
    "locator": "examples/m1-dry-runs/formal-analysis/reports/study-closeout.md",
    "digest": {
      "algorithm": "SHA-256",
      "status": "VERIFIED",
      "value": "f494c751ce094bfc85bb55c41940bead4d16894dc5793e5ffe60d2d260a75eee",
      "scope": "RAW_FILE_BYTES"
    },
    "media_type": "text/markdown"
  },
  "closeout_authority": "LCMRP-SYNTHETIC-DRY-RUN-LOCAL-FIXTURE-AUTHORITY",
  "closed_at": "2026-07-21T14:20:00Z",
  "limitations": [
    "SYNTHETIC-DRY-RUN lifecycle publication is isolated example serialization, not a production closeout, research evidence, or independent validation.",
    "Closeout completeness establishes only set equality and exact record binding; it does not establish truth, novelty, external validity, or usefulness.",
    "The exact subject is a deliberately trivial two-atom system and is not FMO-0.1 or a substantive memory formalism."
  ],
  "mechanism_maturity_effect": {
    "applicability": "NOT_APPLICABLE",
    "mechanism_under_evaluation": false,
    "may_award_mechanism_evidence_labels": false,
    "may_change_mechanism_evidence_profile": false,
    "awarded_mechanism_evidence_labels": [],
    "rationale": "A synthetic foundational-study closeout records fixture completeness only and cannot award mechanism maturity."
  },
  "created_at": "2026-07-21T14:20:00Z"
}
